Assignment,Student Username,Draft,Submitted Date,Answer
Favorite Activity,awright,,9/1/2018,"Sweating, I walked into the gym. I was at Triple A baseball tryouts. All the kids looked older than me. Then I saw a few of my friends from soccer making me feel a bit better. I started warming up while my dad was signing me in. I heard the sweet sound of the bat’s “crack!” as the ball hit it…I wondered how well I’d do. Then, it was my turn to bat. “You better not blow it!” a voice in my head said.I batted. Getting only one good hit didn’t impress me. But, little did I know, I had been chosen. The coach would call me in a few weeks, and give me the great news. “Okay Billy, good luck!” It was my first game, and I was up to bat. “Ball!” the ump yelled. Faster than I’d ever imagined, two strikes, and three balls had wizzed by. It was full count. The pitcher wound up. He thought the ball fast, hard, but too low. I’d gotten my first walk."
Science Paper,awright,,10/1/2018,"I imagine my skies blowing up clouds of snow. I absolutely love the cold air striking my face. It is the best weather to ne in. Cold snowy weather brings bushels of fun. I love the snowy weather so much because down here we don’t get snow. The snowy weather also reminds me of Christmas which puts a big smile on my face. Even though it’s a long journey to where it snows, it’s worth it. The fun to have when it snows is endless. The feeling of waking up in the morning and looking out on to what seems to be mountains of ice cream. Being snuggled up in a dog sled getting a high range view that only happens at a special time of year it makes you feel as if you are in heaven. Snowball fights are so fun because when you throw one they don’t hurt and then the real action begins when you start climbing snow banks and hiding behind trees and when you’re just about to hit someone, wham! A snow ball hits you in the back then you fall over laughing. At the end of the day though, it seems as if it is the greatest time ever because when you sit down under the twinkling stars with your family around a fire. It is as if love has encircled you in a blanket of warmth."
Journal Entry,awright,,11/1/2018,"Do you know someone who would send their own child to die for the sins of the world? Any normal parent would say “No way!” Did you know that God did that very thing? He sent His only son to die for us, so that we may have eternal life with God in Heaven, Salvation should be a good enough reason to give your life to Jesus Christ. There are many reasons why you should give your life to Christ Jesus. First of all, we are all sinners and we fall short of the glory of God. The Bible tells us that. However, if we believe in the Lord Jesus as our personal savior and live and try to be like Him, we will have eternal life. You know God created us in His image and if you think about it He didn’t have to create us at all. I guess what I am trying to put into words is that God loves us so much and He gave us a gift. Why not take it. As you can see God’s love and grace are amazing and unchanging. He wants us to love and serve Him."
Story,awright,,12/1/2018,"It all started with a dare. “Bet you don’t have the guts to sneak down to the basement of the school,” Jackson taunted. I regretted my response the moment the words flew from my mouth. “How much you wanna bet?” We’d all heard about the basement of the century old building. It was rumored to be dark as a dungeon and smelled musty and damp. Up in our classrooms we could hear the gigantic old boiler churning and belching. It was like a big mechanical monster hiding in its cave waiting for an unsuspecting student to happen by.  Jackson grinned wickedly. “I’ll bet you twenty bucks you won’t do it!” He must have been pretty sure of himself. “Deal!” I said, thinking of what I could buy with that money. The question was, how would I do it? Student’s weren’t allowed down there. All day long I worried. Sweat formed on my brow and my knees felt like rubber. I looked at the clock. Five minutes until dismissal. I raised my hand and pointed to the bathroom pass. Miss Tucker nodded. I got up, grabbed the pass, and headed out the door.  I slunk past the boy’s room, casting a glance over my shoulder to see if anyone was around. The hall was deserted. I took a deep breath and ran toward the stairwell. Down the first flight, then the second. I hesitated. But there was no turning back. I took hold of the doorknob with trembling hands and slipped through the door. It closed behind me with a swoosh and a clunk. The sounds of the school disappeared as I entered this dim, mysterious inner sanctum. I crept down the stairs, sweaty hand on the railing. It was dark down there, with no light coming in except through the narrow windows along the top of the wall. Suddenly a coughing, sputtering sound stopped me short. It was followed by a huge whooshing noise-the boiler! At the same time a grotesque shadow loomed across my path and danced against the wall. A monster-like silhouette-huge head with wild hair, an enormous nose and protruding jaw, something that looked like a club clenched in its paws. I jumped back into the shadows, my heart racing. The shadowy beast shuffled toward me, closer and closer. I shut my eyes and held my breath, hoping against hope that I wouldn’t be detected. “Ahhh!” the beast hollered. “Ahhh!” I screamed. My eyes flew open. Mr. Mac, our custodian, stood before me, holding a mop, his other hand over his heart. “What are you doing here?” he cried. “You scared me half to death!”  “I’m sorry!” I gasped. “Jackson dared me to come down here. Kids say that…” Mr. Mac grinned. “I know what they say. That there’s a monster in the basement.” He winked at me. “I have an idea…” He pulled out a pair of scissors, snipped off a few filthy wet strands of yarn from the mop and handed it to me. “Monster hair,” he said. “Thanks Mr. Mac,” I answered, and headed up the stairs. As I opened the door I came face-to-face with my class heading to the bus. Jackson stared, wide-eyed. I held up the proof that I’d ventured into the basement. “Monster hair!” I exclaimed. “Time to pay up!”  Miss Tucker glared at me, took me by the shoulder, and marched me toward the office. But, seeing Jackson’s surprise made it all worthwhile. As I took a seat in the detention chair I dreamed about how I would spend my twenty bucks!"
Journal Entry 2,awright,,2/1/2019,"Different people have different ambitions. Some people want to be doctors, engineers and scientists while some hope to become architects, musicians and teachers. As for me, I wish to be a lawyer. I think being a lawyer is a challenging job. Imagine, going to the court and fighting for justice. I will stand for right and try to win the case. If I work hard enough, I will be the judge. I want to be a widely-known and famous lawyer. Not only do I want to be a lawyer. I will try to help the poor, disabled and aged people, If I want to make my wish come true, I must work extremely hard. I will go overseas, get a degree and come back to do my duty as a lawyer."
Favorite Activity,asmith3,,9/1/2018,The boy scouts followed The Tracks To a cave. We found a hole in a mountain. Are den ledder wend down it. There was skulls and gold lots of gold. There was lots more. We Took it out and went to the bus. The gold was gone we Took all of it. Now we went farther in the cave.There was more and more skulls. It was dark and dap. Suddenly Andrew found a Treasure chest. When we went farther Byron found another one. Now we were all Timbling with are rubyres. Suddenly a skull fell we all scred. We ran as fast as we could one after another droping all The pearls and plases stones. We started on avalanche in the cave. We lost all of are stuff. We thought we had some gold but we left the door open and it got stoled.
Science Paper,asmith3,,10/1/2018,"This amazing sea animal has a unique appearance. The horseshoe crab has a crusty, brown, hard, helmet shaped shell. The shell needs to be brown to blend in with the sand and to protect it from enemies. This sea share dweller can weigh up to about 12 lbs and grow up to 2-3 feet long. Its long spiky tail helps it steer and move. It also helps it flip right side up if it’s upside-down."
Journal Entry,asmith3,,11/1/2018,"A place that is special to me is Austin Books and comics or ABC for short. ABC is A store in Austin , Texas that sells a variety of things. ABC is a pretty small store,but it has really fantastic merchandise. Some things they sell are comics, books, toys, and clothing. Also, a lot of their comics are really cheap. Some are only 50 c!  They also have a few statues of super heroes. In the middle of the store, thier is a humongus statue of the incredible Hulk. Hanging from the cieling thier is a life size silver surfer. I really enjoy going to Austin Books and comics because it is really spectacular, and It is by a delicous restraunt to get dinner. If you live in a different town though, you might not get to go very often. Austin books and comics is probablly my favorite store and i’m always begging my mom to go. Those were some reasons why Austin book and comics is a special place to me."
Story,asmith3,,,
Journal Entry 2,asmith3,,2/1/2019,"A place that is special to me is Austin Books and comics or ABC for short. ABC is A store in Austin , Texas that sells a variety of things. ABC is a pretty small store,but it has really fantastic merchandise. Some things they sell are comics, books, toys, and clothing. Also, a lot of their comics are really cheap. Some are only 50 c!  They also have a few statues of super heroes. In the middle of the store, thier is a humongus statue of the incredible Hulk. Hanging from the cieling thier is a life size silver surfer. I really enjoy going to Austin Books and comics because it is really spectacular, and It is by a delicous restraunt to get dinner. If you live in a different town though, you might not get to go very often. Austin books and comics is probablly my favorite store and i’m always begging my mom to go. Those were some reasons why Austin book and comics is a special place to me."
Favorite Activity,barmstrong,,9/1/2018,"Last Saturday I went over David’s house and we played the Sega and the N64 then we went outside, and played football then we went back inside and played with his Ginne Pig then we went over my house, and jumped on the trampoline for a little while then we went in my house, and played the playstation for awile then we went to Craig’s house, and played his Sega Dream Cast for awile then went back over David’s house and watched tv. and then me, and Craig spent the night over David’s. and we scared his sisters by putting on scream and zombie looking mask.me and Craig spent the night and we stayed up all night playing game playing with his Ginne Pig, and playing his Sega Dream Cast, and also playing the NC4, and watching Batle Bots and cartoons."
Science Paper,barmstrong,,10/1/2018,"Do you know a creature who has a spiny tail and a hard brown hat? If you guess the horseshoe crab you are right! Let’s examine their appearance, investigate its habitat, and discover its history, and the incredible facts that are waiting to be uncovered."
Journal Entry,barmstrong,,11/1/2018,"Some mothers are the go-up-to-your-room-you’re-grounded kind, but my mom isn’t anywhere close to that kind! She’s everything I want to be, she works out problems, and she always has a happy-go-lucky attitude. To begin with, she’s everything I want to be because she’s healthy, caring, and loving. She’s been going crazy about the “stay healthy” thing, but I know she’s doing it for us. Next, she works out problems. Whenever we’re arguing, or I’m stuck on something, Mom to the rescue! If we’re arguing, she has us go to our rooms and think about what we did. Soon enough, we’re best friends again! My mom also has a happy-go-lucky attitude because she never yells (unless it’s absolutely needed!) That’s why I love her! I know my mom is the best, most perfect number one mther in the world!"
Story,barmstrong,,12/1/2018,"I held up my knee length nightgown. My mom held up my flece ankle length pj’s. Why should I wear those? “I said. Wear flece on a warm summer night in Montana. “It gets very cold in the night,” my mom said with a serious look on. I gave her a look, she looked right back at me for a moment there was silence. Then she let out a long sigh. I could tell I had won because she was putting away the pj’s. As I slid on my nightgown I could feel my mom herding me to my bed. I stopped and climbed in. I pulled up my light sheets. My mom opened her mouth and said “Put your wool cover over you, I’m serious!” I gave her a look. She let out a sigh. She hugged me and whispered in my ear “Good night.” I woke up with a tingle, I sat up in my bed. I looked at the clock, only ten minutes went by. I looked at my arms they were covered in goosebumps, so were my legs. It felt like it had dropped thirty degrees. I bent down and grabbed the wool blanket and pulled it over me with a sigh of relief. As I got comfy my mind soared. I thought about all the times my mom told me pack extra snack, I didn’t and got hungry. Or the time I didn’t wear rainboots when my mom told me and got cold. Then the time my mom told me to put on sunblock, I didn’t and got a really bad sunburn. But out of all my thoughts I wondered why I acted like that? Was I cranky or mad? But before I could think my eyes got heavy and started to close, before I knew it everything was black and then gone."
Journal Entry 2,barmstrong,,2/1/2019,"The thing is that ‘becoming’ and ‘transformation’ are very material- the body is relentlessly, often annoyingly, at times joyously, material. And I wrote The Spectral Wilderness from inside a body that in its transformation had me more honed in on what I could hold/ what would hold."
Favorite Activity,cspencer,,9/1/2018,"When kids grow up they want to be movie stars, pop stars and even astronauts. They want to have huge familys, but I don’t. The first thing I want to do is go to college. I want to go to W.S.U., Washington State University, in Pullman, Wa. I want to get a business degree. The second thing I want to do is open my own dance studio. I’d be a teacher and my mother would run the front desk. I dance at Debbi’s Dance Etc. I have been for the last 5 ½ years. Some of my friends dance too, and we think it is so much fun. The third thing I want to do is to get married and have a family, 2 girls or 2 boys or even a boy and a girl having a family is what I want most. Going to college, having a job that I want and having a family are the things I want to do when I’m grown up."
Science Paper,cspencer,,10/1/2018,"Where does the horse shoe crab live? In the salt water ocean and the sandy sea shore of course. The tall grasses of the marshes help the crustacean hide from predators there. These invertebrates also live in the warm waters of the Asian- Mexican seashores, I’ll never forget the time when I went to Mystic Aquariam to touch a real live horseshoe crab in its manmade seashore habitat"
Journal Entry,cspencer,,11/1/2018,There was a girl named Lilly. Lilly was with her friends. Lilly and her friends went to an old shop. Lilly found a old book and her friends said to open it. And she opened it. The book started to light up and it sucked her in. Her friends just ran back home. Lilly fell in a batch of gummy worms.
Story,cspencer,,12/1/2018,"This alien named Sparkles loved space pineapples. But there where no more at the space store so she went to the other space store. She saw the space pineapple so she ran as fast as she can. But the space store closed. She begged and begged so he let her in. But there was only one space pineapple left and this other girl named Colors wanted the space pineapple too. So they had to space race and Sparkles had the power to stop people so Sparkles won. And finally, she got her space pineapple."
Journal Entry 2,cspencer,,2/1/2019,"I love zines and flyers as alternative modes of creation and distribution. They are fun to make and I think fun to encounter, and they circulate differently. I also like anyone can make a zine- the only gate- keeper is the photocopier."
Favorite Activity,dcity,,9/1/2018,"Don’t you love the cool warm sun? The melted icecream on a cone? Grabbing seashells on the beach? You can get this package anytime in the summer. I’m writing about my favorite season, summer. I love the hot sun at the beach. Where the water is warm and the sand is hot. When I surf the wind follows in My scalp I lick my salty lips as my pruny fingers touch the water. When I go to shore I lay on my towel as the sun tans my skin as if I were bread in a toaster, I then cool down my golden skin in the shallow part of the ocean. the hot sun at the beach is one reason summer is my favorite season. My mother and I go near the beach and try on funny hats. We go to this shop called Hats galore that have thousends of hats. We try on hats and send pictures to my dad. I stick out my tongn as my mom makes a fish face."
Science Paper,dcity,,10/1/2018,"Would you believe the many amazing facts about the spiky tailed creature? Can you believe that this seashore dweller lived 100 years before dinosaurs? Its relatives are the tick scorpion, and spider, animals my mom certaintly don’t want in her house. Amazingly, this invertebrate can lay 20,000 eggs at one time. Gladly it doesn’t need to take care of all these babies! You’ll be shocked to learn that this amazing seacreature can swim upside-down."
Journal Entry,dcity,,11/1/2018,My lunchtime is loud. Almost everybody in the lunchroom is making noise. We have very good food and nice cooks. We have 35 minutes to eat lunch. My lunchroom is big and has a lot of tables. We have milk and a salad bar for the teachers. That is what my lunchroom is about.
Story,dcity,,12/1/2018,"Ugh! That hideous, and nasty graffiti on that wall! How can anyone stand this horrible art. Just looking at it sends shivers down my spine. Somebody has to send some operation to clean this up! (They did but I’ll get more into that later) And even worse it’s on a valuable school! Man, this school sure needs help! This is why, I think students should be able to improve their schools from activities.  To start with, if students will be able to paint on the walls, (leasureart not graffiti) it can do many benefits for schools such as giving schools a better look. You can brighten up the plain old hallways. Give it that spark of imagination and creativity that’s inside of you! Make your school a place where people want to be and make that visit pleasurable! Secondly, morals can paint messages. Such as courage, perseverance, etc. This could lift students spirits when they are feeling down. This reminds me of the time I started the school. The hallways were so dull I couldn’t even stand the place. What I didn’t know is that for the first assignment of the school year we have to express ourself in a moral. The next day a bomb of color set off Boom! Every inch of the school was exploding with color. Now this takes me to Operation Clean Slate. This operation started by a man named Michael Howard. I was at the edge of my seat when I read that Michael Howard’s operation helped paint more than700 murals. In the text starting with a clean slate and a lot of paint. Now that’s a spark of imagination."
Journal Entry 2,dcity,,2/1/2019,"I think dogs are the best friends a kid could ever have! Dogs make great pets because they are good companions and they are helpful. However, they are a big responsibility to take care of.  Dogs are great companions. Many are loyal, and will not disobey their masters. For example, my dog, Casey, always listens to my stepfather. Puppies are energetic and very playful. They love kids, and they like to play with them. Dogs like to play games such as fetch or tug-of-war. Whenever people are lonely, they could get a dog. That way, they will have a cuddly friend to hang around with. Many  small dogs like to curl up in their owner’s lap and fall asleep. (Dogs are really nice companions.) Dogs are very helpful. They are used in many jobs because of their great sense of smell and hearing. Fire dogs help in fires. They save people by going through an entrance that is blocked by the fire and leading the person out. Sled dogs, such as Samoyeds, race other sleds to help their owner get to a place he or she wants to go to. You might think a musher says mush when they want to make the dogs run, but they really say, “Hike!” Another job is that dogs can help blind people get to places without another person. They are attached to a special leash, and if the person swims, they have to swim, also. That way the person doesn’t swim too far. Visiting dogs also have important jobs. They visit hospitals to make sick people happy."
Favorite Activity,eblack,,,
Science Paper,eblack,,,
Journal Entry,eblack,,11/1/2018,A is very different to B but they are the same in some ways. First way is size. A is smaller and B is bigger. A has less than one million people. B has two million. Second way is weather. Here is snow and cold. B is rainy and hot. A has four seasons but B has two seasons – dry and raining. A has museums at many palces but B has only two small museuems. A doesn’t have many trains but in B we see trains all of the time and they carry many people at everywhere. Those are the different and same stuff about A and B.
Story,eblack,,,
Journal Entry 2,eblack,,2/1/2019,"My lunchtime is loud, almost everybody in the lunchroom is making noise. We have very good food and nice cooks. We have 35 minutes to eat lunch. My lunch room is big and a salad bar for the teachers that is what my lunch room is about."
Favorite Activity,ggardner,,9/1/2018,"Rod floors, long trampolines, and big squshy mats, who wouldn’t want to be a part of that?! Cheerstation is a very special place to me. Never the less rod floors are the best! The rod floor is special to me because you get to do punch-fronts, round-off triple backhand-springs and round-off backhand-spring layouts.  Would you love to have buff coaches around you, because they can one man, give you tips, and spot on new skills. Last but not least, Tumbling. Do you love to do stuff like, standing tucks, toetouch backhand-spring and punch front round-off backhand-spring? Would you like to have buff coaches around? Do you love to tumble? Or maybe even have a couple of rod floors here and there? If so, Cheerstation is the place for you."
Science Paper,ggardner,,,
Journal Entry,ggardner,,,
Story,ggardner,,,
Journal Entry 2,ggardner,,,
Favorite Activity,jdunn,,,
Science Paper,jdunn,,,
Journal Entry,jdunn,,11/1/2018,"Do you like your job? Is it the one you wanted as a little kid? When I grow up I want to be a chef because I will be able to serve many kinds of food and desserts to people and I will meet other people each day. I would like to be a chef because you get to learn different types of ingredents for many pastries. A lot of chefs taste their cakes to see if its amazing for people to eat. I will be a chef to serve a lot of people with my delicous food. Manys chefs compete in compitions to see who has the best food. I’ve always dreamed of being a chef because they get to do things that surprise people. When I am a chef I will change the world with my best talent. I will make my own creations like cupcakes with two pounds of cream. Making new things like food and desserts make me feel explosive. I love to make little twist to my food so it can get better. To be a chef it can be amazing because you could make anything you want to like icecream, and hamburgers. I vow to keep on learning how to make more desserts to share with the people. Be who you are and don’t let anyone stand in your way."
Story,jdunn,,,
Journal Entry 2,jdunn,,,
Favorite Activity,jreid,,9/1/2018,"Do you like your job? Is it the one you wanted? When I grow up I want to be a chef because I will be able to learn how to cook because I will cook my food how I cook at home but it will taste different. When I become a chef my food will be better to eat. If I become a chef and know how to cook better I might get more comments about my food. When I am a chef I will get to try new seasoning because when I cook I have to taste the food. When I make the food I will make French food. When I go places I will eat their food and see if our food taste the same as theirs. Cooking is important to me because when people get hurngy they will have something to eat. As a chef, I vow to always serve people French food."
Science Paper,jreid,,,
Journal Entry,jreid,,11/1/2018,"People should learn about the resources at their local library, place book requests, make use of meeting space, check out books, read, read, and read. Ask your local library to clarify their patron privacy policies. Request books by people of color, LGBT authors, women, muslim, immigrants- so they know there’s demand."
