Assignment,Student Username,Draft,Submitted Date,Answer
Story,jreid,,12/1/2018,"White pearly-seashells, relaxing under the shade, and playing volleyball? It’s the beach we’re talking about! Shiny rainbows across the beautiful shells… of course you want the shell! First reason I love the beach is that there is many different types of shells. Imagine this, every single shell calling out your name, saying, “Take me home!” But you better hurry up and pick those shells because they can go back to the ocean just because of a little wave. Ahh… just relaxing under the palm tree, with a drink, and letting your toes getting wet in the water…now that’s relaxing. You can always relax at the beach, no matter what. Another way to relax is to close your eyes, hear the sounds and take a deep breath. S W O S H! B O O M! Volleyball is a great sport to play at the beach. You can run, jump, and even at the same time in volleyball! This is why I love the beach… just forget the sharks and jellyfishs… think of the positive things. Relaxing, volleyball, and best, collecting shells."
Journal Entry 2,jreid,,,
Favorite Activity,kred,,9/1/2018,"My knees are shaking because I’m nervous and I have to make a choice to go fishing. First get supplies, thana boat and Final Fish!! First I need to get supplies at the hardware store like: a fishing pole, string, and bait. Bait is like fare fish that attracts giant and tiny fish. It help trick fish into eating it, but fish have a choice to be or not to be tricked. That why some fish are getting extint. Next I need to find a boat. Nice! There are so many verities of colors: blue, green, orange, and gold. I like the blue one because it matches the water and looks camoflodge, so no fish will recognize it. It’ll give me an oppertanity to capture a fish without it swimming away. Finaly I get to fish. Wow! I got a bite! I ganked with all my strength and the fish plopped out of the water. It was a giant fish. A fish the size of a tire.I put it in my bucket and brought it out to compare it with a different fish.the first one was bigger than the other. I threw back the other and kept the first one. Man! I am sweating because I finaly made a choice. I’m also proud of myself because I acomplishe my goal."
Science Paper,kred,,10/1/2018,"When you want to play under the sprinkler, make sure the lawn is being watered. In the summer time people like to play under the sprinkler, but if the lawn is already wet, there is no point of it getting watered again. When the sprinkler is running, it should always be used for two purposes, fun and funktion."
Journal Entry,kred,,11/1/2018,"Ronald Reegan, the 40th president of the U.S. once said, “ We can’t help everyone, but we can help someone.” I think he was saying that caring for others is important, and I agree.  To begin with, caring for others is important because you would want others to care for you. For example, last week I was on the playground playing tag. I was running along and steeped on a sharp piece of glass. The glass sliced through my shoe and punctured my foot. “ Ouch!” I screamed. Just then my friend Kirby ran over, helped me up, and walked me to the nurses office. Now anytime I see someone else hurt, I think of how Kirby helped me. In conclusion, if you want others to help you, help them first. There’s always something you can do."
Story,kred,,12/1/2018,"Suddenly feeling a whip of semi-pain, is what Catwoman’s whip is all about. Riding on a not so sturdy rollercoaster can get crazy if you go on Thunderbolt. The rollercoaster was one of the first ones built at the park, feels like you are trapped in a wild thunderstorm. It is amazing that the waterpark is the favorite part of the amusement park to so many people. Like my brother says, “ You can never get enough of the worlds strangest element.” Being slashed around the wavepool is exciting to try and swim through. A delirious rain is no match for the sprinklers at Six Flags. Sitting in an inflated life preserver, and being engulfed by giant waterfalls, really gives you the feeling of a hurricane. Lastly, the tube slides will make you want to scram for your mother, when you lie inside the dark tunnel, and can’t see a thing, until you get to the end. As you can see, being at Six Flags New England, can be the 3 d’s: dangerous, delicious, and of course delirious. So get ready for the mouthwatering food, exciting rides, and refreshing water park."
Journal Entry 2,kred,,2/1/2019,My little brother pulled the towel out from under me and I fell face first in the sand. The hot gritty  sand tasted salty. I could hear Sam laughing and I was getting madder by the minute. Suddenly I felt something moveing by my cheek. When I wiped the sand off my face I saw a nest of sea turtle eggs. Baby sea turtles were hatching out of blue speckled eggs. The minute they hatched they ran right to the sea.